### ISSUE TITLE
New Ceph cluster setup fails at master election

### ISSUE THREAD

**Issue by akarneliuk** [ceph/ceph-ansible#7167]
Hello folks,

I'm trying to setup a new ceph cluster using ceph-ansible. Got an error at step of the master election

**Bug Report**

What happened:
```
TASK [ceph-mon : waiting for the monitor(s) to form the quorum...] ********************************************************************************************************
Tuesday 26 April 2022  21:11:30 +0000 (0:00:00.144)       0:07:12.438 ********* 
FAILED - RETRYING: waiting for the monitor(s) to form the quorum... (10 retries left).
FAILED - RETRYING: waiting for the monitor(s) to form the quorum... (9 retries left).
FAILED - RETRYING: waiting for the monitor(s) to form the quorum... (8 retries left).
FAILED - RETRYING: waiting for the monitor(s) to form the quorum... (7 retries left).
FAILED - RETRYING: waiting for the monitor(s) to form the quorum... (6 retries left).
FAILED - RETRYING: waiting for the monitor(s) to form the quorum... (5 retries left).
FAILED - RETRYING: waiting for the monitor(s) to form the quorum... (4 retries left).
FAILED - RETRYING: waiting for the monitor(s) to form the quorum... (3 retries left).
FAILED - RETRYING: waiting for the monitor(s) to form the quorum... (2 retries left).
FAILED - RETRYING: waiting for the monitor(s) to form the quorum... (1 retries left).
fatal: [os-controller-storage-1]: FAILED! => changed=false 
  attempts: 10
  cmd:
  - docker
  - exec
  - ceph-mon-os-controller-storage-1
  - ceph
  - --cluster
  - ceph
  - daemon
  - mon.os-controller-storage-1
  - mon_status
  - --format
  - json
  delta: '0:00:00.365299'
  end: '2022-04-26 21:14:57.237150'
  rc: 0
  start: '2022-04-26 21:14:56.871851'
  stderr: ''
  stderr_lines: <omitted>
  stdout: '{"name":"os-controller-storage-1","rank":-1,"state":"electing","election_epoch":1,"quorum":[],"features":{"required_con":"0","required_mon":[],"quorum_con":"0","quorum_mon":[]},"outside_quorum":[],"extra_probe_peers":[{"addrvec":[{"type":"v2","addr":"100.64.1.10:3300","nonce":0},{"type":"v1","addr":"100.64.1.10:6789","nonce":0}]},{"addrvec":[{"type":"v2","addr":"100.64.1.11:3300","nonce":0},{"type":"v1","addr":"100.64.1.11:6789","nonce":0}]},{"addrvec":[{"type":"v2","addr":"100.64.1.12:3300","nonce":0},{"type":"v1","addr":"100.64.1.12:6789","nonce":0}]}],"sync_provider":[],"monmap":{"epoch":0,"fsid":"51cb19c8-1e82-45db-9c44-dac6a5b65f98","modified":"2022-04-26T21:11:22.990635Z","created":"2022-04-26T21:11:22.990635Z","min_mon_release":0,"min_mon_release_name":"unknown","election_strategy":1,"disallowed_leaders: ":"","stretch_mode":false,"tiebreaker_mon":"","features":{"persistent":[],"optional":[]},"mons":[{"rank":0,"name":"os-controller-storage-1","public_addrs":{"addrvec":[]},"addr":"(unrecognized
    address family 0)/0","public_addr":"(unrecognized address family 0)/0","priority":0,"weight":0,"crush_location":"{}"},{"rank":1,"name":"os-controller-storage-2","public_addrs":{"addrvec":[{"type":"v2","addr":"100.64.1.11:3300","nonce":0},{"type":"v1","addr":"100.64.1.11:6789","nonce":0}]},"addr":"100.64.1.11:6789/0","public_addr":"100.64.1.11:6789/0","priority":0,"weight":0,"crush_location":"{}"},{"rank":2,"name":"os-controller-storage-3","public_addrs":{"addrvec":[{"type":"v2","addr":"100.64.1.12:3300","nonce":0},{"type":"v1","addr":"100.64.1.12:6789","nonce":0}]},"addr":"100.64.1.12:6789/0","public_addr":"100.64.1.12:6789/0","priority":0,"weight":0,"crush_location":"{}"}]},"feature_map":{"mon":[{"features":"0x3f01cfb9fffdffff","release":"luminous","num":1}]},"stretch_mode":false}'
  stdout_lines: <omitted>

NO MORE HOSTS LEFT ********************************************************************************************************************************************************

PLAY RECAP ****************************************************************************************************************************************************************
os-controller-storage-1    : ok=133  changed=28   unreachable=0    failed=1    skipped=278  rescued=0    ignored=0   
os-controller-storage-2    : ok=118  changed=24   unreachable=0    failed=0    skipped=260  rescued=0    ignored=0   
os-controller-storage-3    : ok=118  changed=24   unreachable=0    failed=0    skipped=260  rescued=0    ignored=0   


INSTALLER STATUS **********************************************************************************************************************************************************
Install Ceph Monitor           : In Progress (0:04:18)

```

What you expected to happen:
The setup of the ceph cluster with ceph-ansible shall be completed successfully.

How to reproduce it (minimal and precise):
```
git clone https://github.com/ceph/ceph-ansible.git
cd ceph-ansible/
git checkout v6.0.25.5
python3.9 -m venv venv
source venv/bin/activate
pip install -r requirements.txt 
vim.tiny hosts
ansible-playbook site-container.yml -u username -k
```

Share your group_vars files, inventory and **full** ceph-ansibe log

**Environment**:
* OS (e.g. from /etc/os-release):
```
$ cat /etc/os-release 
PRETTY_NAME="Ubuntu 22.04 LTS"
NAME="Ubuntu"
VERSION_ID="22.04"
VERSION="22.04 (Jammy Jellyfish)"
VERSION_CODENAME=jammy
ID=ubuntu
ID_LIKE=debian
HOME_URL="https://www.ubuntu.com/"
SUPPORT_URL="https://help.ubuntu.com/"
BUG_REPORT_URL="https://bugs.launchpad.net/ubuntu/"
PRIVACY_POLICY_URL="https://www.ubuntu.com/legal/terms-and-policies/privacy-policy"
UBUNTU_CODENAME=jammy
```
* Kernel (e.g. `uname -a`):
```
Linux os-controller-storage-3 5.15.0-27-generic #28-Ubuntu SMP Thu Apr 14 04:55:28 UTC 2022 x86_64 x86_64 x86_64 GNU/Linux
```
* Docker version if applicable (e.g. `docker version`):
```
: permission denied
lab@os-controller-storage-3:~$ sudo docker version
Client: Docker Engine - Community
 Version:           20.10.14
 API version:       1.41
 Go version:        go1.16.15
 Git commit:        a224086
 Built:             Thu Mar 24 01:47:47 2022
 OS/Arch:           linux/amd64
 Context:           default
 Experimental:      true

Server: Docker Engine - Community
 Engine:
  Version:          20.10.14
  API version:      1.41 (minimum version 1.12)
  Go version:       go1.16.15
  Git commit:       87a90dc
  Built:            Thu Mar 24 01:45:38 2022
  OS/Arch:          linux/amd64
  Experimental:     false
```
* Ansible version (e.g. `ansible-playbook --version`):
```
# ansible-playbook --version
ansible-playbook 2.9.27
  config file = /root/ceph-ansible/ansible.cfg
  configured module search path = ['/root/ceph-ansible/library']
  ansible python module location = /root/ceph-ansible/venv/lib/python3.9/site-packages/ansible
  executable location = /root/ceph-ansible/venv/bin/ansible-playbook
  python version = 3.9.2 (default, Feb 28 2021, 17:03:44) [GCC 10.2.1 20210110]
```
* ceph-ansible version (e.g. `git head or tag or stable branch`):
```
# git branch 
* (HEAD detached at v6.0.25.5)
  master
```
* Ceph version (e.g. `ceph -v`):
```
# ceph -v
ceph version 16.2.7 (dd0603118f56ab514f133c8d2e3adfc983942503) pacific (stable)
```

* Group_vars/all.yaml:
```
---
##########
# DOCKER #
##########
containerized_deployment: True

##########
# CEPHFS #
##########
public_network: " 100.64.4.0/24"
cluster_network: " 100.64.5.0/24"

######################
# CEPH CONFIGURATION #
######################
monitor_interface: ens18
devices:
  - /dev/sdb

#############
# DASHBOARD #
#############
dashboard_enabled: True
grafana_admin_password: aaa
dashboard_admin_password: aaa
...
```

Please, let me know how to fix

**Comment by guits** [comment]
please, provide full group_vars, inventory and **full** ceph-ansible logs.

in any case, I suspect the leading spaces in these 2 variables are causing an issue here:

> public_network: " 100.64.4.0/24"
> cluster_network: " 100.64.5.0/24"


Can you verify this?

**Comment by akarneliuk** [comment]
Hello @guits ,
The traffic is running:
```
$ sudo tcpdump -i any tcp port 3300 -en -vvvv
tcpdump: data link type LINUX_SLL2
tcpdump: listening on any, link-type LINUX_SLL2 (Linux cooked v2), snapshot length 262144 bytes
14:58:28.330465 ens18 Out ifindex 2 4e:51:27:0b:35:23 ethertype IPv4 (0x0800), length 520: (tos 0x0, ttl 64, id 6906, offset 0, flags [DF], proto TCP (6), length 500)
    100.64.1.10.37148 > 100.64.1.11.3300: Flags [P.], cksum 0xcc7b (incorrect -> 0x51cd), seq 3084957824:3084958272, ack 1192876005, win 501, options [nop,nop,TS val 3409655706 ecr 3453641962], length 448
14:58:28.330488 ens18 Out ifindex 2 4e:51:27:0b:35:23 ethertype IPv4 (0x0800), length 520: (tos 0x0, ttl 64, id 48070, offset 0, flags [DF], proto TCP (6), length 500)
    100.64.1.10.57422 > 100.64.1.12.3300: Flags [P.], cksum 0xcc7c (incorrect -> 0xb38f), seq 2696387487:2696387935, ack 1459876391, win 501, options [nop,nop,TS val 544143457 ecr 2651102922], length 448
14:58:28.330852 ens18 In  ifindex 2 ea:14:c6:56:9b:fc ethertype IPv4 (0x0800), length 72: (tos 0x0, ttl 64, id 16559, offset 0, flags [DF], proto TCP (6), length 52)
    100.64.1.11.3300 > 100.64.1.10.37148: Flags [.], cksum 0xcabb (incorrect -> 0x35ca), seq 1, ack 448, win 501, options [nop,nop,TS val 3453645975 ecr 3409655706], length 0
14:58:28.331012 ens18 In  ifindex 2 0e:9a:22:8f:01:0a ethertype IPv4 (0x0800), length 72: (tos 0x0, ttl 64, id 350, offset 0, flags [DF], proto TCP (6), length 52)
    100.64.1.12.3300 > 100.64.1.10.57422: Flags [.], cksum 0xcabc (incorrect -> 0xd6c2), seq 1, ack 448, win 501, options [nop,nop,TS val 2651105317 ecr 544143457], length 0
14:58:28.331065 ens18 In  ifindex 2 ea:14:c6:56:9b:fc ethertype IPv4 (0x0800), length 168: (tos 0x0, ttl 64, id 16560, offset 0, flags [DF], proto TCP (6), length 148)
    100.64.1.11.3300 > 100.64.1.10.37148: Flags [P.], cksum 0xcb1b (incorrect -> 0x174f), seq 1:97, ack 448, win 501, options [nop,nop,TS val 3453645976 ecr 3409655706], length 96
14:58:28.331082 ens18 Out ifindex 2 4e:51:27:0b:35:23 ethertype IPv4 (0x0800), length 72: (tos 0x0, ttl 64, id 6907, offset 0, flags [DF], proto TCP (6), length 52)
    100.64.1.10.37148 > 100.64.1.11.3300: Flags [.], cksum 0xcabb (incorrect -> 0x3568), seq 448, ack 97, win 501, options [nop,nop,TS val 3409655707 ecr 3453645976], length 0
14:58:28.331189 ens18 In  ifindex 2 0e:9a:22:8f:01:0a ethertype IPv4 (0x0800), length 168: (tos 0x0, ttl 64, id 351, offset 0, flags [DF], proto TCP (6), length 148)
    100.64.1.12.3300 > 100.64.1.10.57422: Flags [P.], cksum 0xcb1c (incorrect -> 0x7817), seq 1:97, ack 448, win 501, options [nop,nop,TS val 2651105318 ecr 544143457], length 96
14:58:28.331241 ens18 Out ifindex 2 4e:51:27:0b:35:23 ethertype IPv4 (0x0800), length 72: (tos 0x0, ttl 64, id 48071, offset 0, flags [DF], proto TCP (6), length 52)
    100.64.1.10.57422 > 100.64.1.12.3300: Flags [.], cksum 0xcabc (incorrect -> 0xd660), seq 448, ack 97, win 501, options [nop,nop,TS val 544143458 ecr 2651105318], length 0
14:58:28.331276 ens18 In  ifindex 2 ea:14:c6:56:9b:fc ethertype IPv4 (0x0800), length 1608: (tos 0x0, ttl 64, id 16561, offset 0, flags [DF], proto TCP (6), length 1588)
    100.64.1.11.3300 > 100.64.1.10.37148: Flags [P.], cksum 0xd0bb (incorrect -> 0xb764), seq 97:1633, ack 448, win 501, options [nop,nop,TS val 3453645976 ecr 3409655707], length 1536
```

My assumption would be if there is an issue with string, it won't be running.

In terms of vars, that's all I have. All others are default `.sample`, I didn't tweak them.

**Comment by guits** [comment]
what you have defined here:
```yaml
public_network: " 100.64.4.0/24"
```

doesn't seem to match what we see here:

```console
$ sudo tcpdump -i any tcp port 3300 -en -vvvv
tcpdump: data link type LINUX_SLL2
tcpdump: listening on any, link-type LINUX_SLL2 (Linux cooked v2), snapshot length 262144 bytes
14:58:28.330465 ens18 Out ifindex 2 4e:51:27:0b:35:23 ethertype IPv4 (0x0800), length 520: (tos 0x0, ttl 64, id 6906, offset 0, flags [DF], proto TCP (6), length 500)
    100.64.1.10.37148 > 100.64.1.11.3300: Flags [P.], cksum 0xcc7b (incorrect -> 0x51cd), seq 3084957824:3084958272, ack 1192876005, win 501, options [nop,nop,TS val 3409655706 ecr 3453641962], length 448
```
in a nutshell, `100.64.1.11` doesn't belong to `100.64.4.0/24`

**Comment by akarneliuk** [comment]
Right, 

as you see in the `all.yaml`, there is a `monitor_interface: ens18` key/value. The subnet `100.64.1.0/24` is configured on those interfaces on all nodes. Do they have to match?

Best,
Anton

**Comment by guits** [comment]
>The subnet `100.64.1.0/24` is configured on those interfaces on all nodes. Do they have to match?

yes

**Comment by akarneliuk** [comment]
Hey @guits ,

After changing the configuration for `monitor_interface` to match `public_network`, it worked. Out of curiosity, if that breaks the setup, why do I have at all 2 these separate parameters? Why shall it be not one, if there is a one to one match?
I've followed this doc for setup: https://docs.ceph.com/projects/ceph-ansible/en/latest/index.html, and it not mentioned in that these keys should match.

Thanks,
Anton

**Comment by guits** [comment]
I think it was just stated that it just goes without saying that `monitor_interface` has to match the subnet you set in `public_network`. I think we are just facing some ghosts from the past, the workflow and/or variable definitions regarding the monitor bootstrap sequence could have been simplified/improved.

**Comment by akarneliuk** [comment]
Solved, thanks.
